{
  "schema_version": 1,
  "command_id": "CMD-2026-09-0001",
  "command_type": "start_run",
  "idempotency_key": "customer-odoo:RUN-2026-09-0001:start",
  "issued_at": "2026-09-05T14:30:00-04:00",
  "issued_by": {
    "actor_id": "local-developer",
    "actor_type": "human",
    "display_name": "Local Developer",
    "authentication_method": "local_dashboard_session"
  },
  "source": "dashboard",
  "target": {
    "system_id": "customer-odoo",
    "run_id": "RUN-2026-09-0001"
  },
  "preconditions": {
    "expected_run_revision": 0,
    "expected_run_state": "requested"
  },
  "payload": {
    "run_kind": "requirement_intake",
    "requirement": {
      "artifact_id": "REQ-0001",
      "revision": 1,
      "path": "requirements/Odoo_Form_Context_Menu_Customization_Design.docx",
      "sha256": "1111111111111111111111111111111111111111111111111111111111111111"
    },
    "run_plan": {
      "artifact_id": "PLAN-REQ-0001-001",
      "revision": 1,
      "path": "run-plans/Odoo_Form_Context_Menu_Implementation_Run_Plan.docx",
      "sha256": "2222222222222222222222222222222222222222222222222222222222222222"
    },
    "product_base_commit": "aaaaaaaaaaaaaaaaaaaaaaaaaaaaaaaaaaaaaaaa"
  },
  "note": "Start the first requirement-intake pilot."
}
